{
  "timestamp": "2026-04-14T13:10:23.063323+01:00",
  "model_id": "openai/whisper-large-v3-turbo",
  "status": "passed",
  "checks": {
    "spec_completeness": {
      "passed": true,
      "missing_fields": []
    },
    "evidence_sufficiency": {
      "passed": true,
      "unsupported_fields": []
    },
    "conflict_resolution": {
      "passed": true,
      "unresolved_conflicts": []
    },
    "build_plan_executable": {
      "passed": true,
      "blocking_issues": []
    },
    "fixture_availability": {
      "passed": true,
      "fixture_path": "tests/fixtures/shared/asr/en_16k_10s.wav",
      "source": "shared_fallback"
    },
    "io_contract_sufficient": {
      "passed": true,
      "missing_contract_fields": []
    },
    "preflight_compatible": {
      "passed": true,
      "incompatibilities": []
    }
  },
  "ready_for_build_env": true,
  "warnings": [
    "uv is unavailable on host, so the preferred uv backend is not executable here.",
    "ffmpeg is unavailable on host; the plan therefore records a model-local fallback binary path if imageio-ffmpeg can supply one during BUILD_ENV.",
    "The requested fixture path tests/fixtures/shared/asr/en_16k.wav is absent in-repo, so phase-1 uses tests/fixtures/shared/asr/en_16k_10s.wav as a shared fallback without narrowing ASR task semantics."
  ],
  "blockers": []
}
